index,user,timestamp,rating,title,review,review_raw
1029,CheeseDeveloper.,20190813T112315,1,Was Entertaining,Seasons 1 and 2 were riveting. Season 3 explodes into some leftist rhetoric where all criminals are excused for their behaviors while all hard working men and women in uniform are portrayed as racist and out to beat the public. The propaganda in this last season is transparent and disgusting.,Seasons 1 and 2 were riveting. Season 3 explodes into some leftist rhetoric where all criminals are excused for their behaviors while all hard working men and women in uniform are portrayed as racist and out to beat the public.  The propaganda in this last season is transparent and disgusting.
1046,Matthew Blaine,20190731T154038,1,Don'T Bother With Season 4,"This podcast has gone completely off the rails. Every episode is about the suspect is innocent and the cops/justice system is wrong. She literally paints convicted criminals, who admit they're in gangs, doing drugs, etc....and tries to paint them as angels. Blames everything in the system and racism. Don't j silt the profession by calling her journalist, because she isn't.","This podcast has gone completely off the rails. Every episode is about the suspect is innocent and the cops/justice system is wrong. She literally paints convicted criminals, who admit they’re in gangs, doing drugs, etc....and tries to paint them as angels. Blames everything in the system and racism. Don’t j silt the profession by calling her journalist, because she isn’t."
1108,The office jerk,20190609T150650,2,Sad Turn,"Season 1 was absolutely outstanding. There were parts where it sounded like you had feelings for Adnan, but it didn't take away from the journalism. By the end of Season 3, you completely embellish the facts to push your leftist agenda, and in doing so, create racism that further divides us as people.","Season 1 was absolutely outstanding. There were parts where it sounded like you had feelings for Adnan, but it didn’t take away from the journalism. By the end of Season 3, you completely embellish the facts to push your leftist agenda, and in doing so, create racism that further divides us as people."
1118,Koja86,20190604T144559,1,From Gold To Garbage,"Season 1 was superb! Enthralling, entertaining, suspenseful... I hate that I can't say as much for the other two seasons! Season 2 I would say was a fair shake towards the subject! However towards the end of the season the liberal leaning agenda begins too bleed through! By season 3 the social justice warrior mentality is in full swing! It honestly ruined a great podcast for me... you wanna report on those type stories, I'll listen, as long as it's from an unbiased standpoint! Season 3 honestly feels like a 3rd Obama term, more stagnation, more racial division, more forget the law and do what makes you feel good about yourself! It's a hard pass for me from here on out!","Season 1 was superb! Enthralling, entertaining, suspenseful... I hate that I can’t say as much for the other two seasons! Season 2 I would say was a fair shake towards the subject! However towards the end of the season the liberal leaning agenda begins too bleed through! By season 3 the social justice warrior mentality is in full swing! It honestly ruined a great podcast for me... you wanna report on those type stories, I’ll listen, as long as it’s from an unbiased standpoint! Season 3 honestly feels like a 3rd Obama term, more stagnation, more racial division, more forget the law and do what makes you feel good about yourself! It’s a hard pass for me from here on out!"
1137,DanaNYC,20190511T195528,5,Thank You For Translating The Criminal Justice System,Sara and the Serial team did a great job of translating the racial injustice of the criminal justice system for a group of people who the flaws of this system does not and will not affect.,Sara and the Serial team did a great job of translating the racial injustice of the criminal justice system for a group of people who the flaws of this system does not and will not affect.
1187,BigKris82,20190405T132719,1,Strong One Sided Perspective,The host obviously goes out of her way to see racism in every aspect of life. I enjoyed season 1 of Serial but this season is from a very anti-police point of view. Would not recommend.,The host obviously goes out of her way to see racism in every aspect of life.  I enjoyed season 1 of Serial but this season is from a very anti-police point of view.  Would not recommend.
1228,brendac22,20190321T135618,5,Outstanding Podcast!,"Serial is a great podcast and Sara did a great job investigating and retracing steps. For those of you who think this podcast is one sided and or makes the police sound like a gang you're ignorant. Theres way too much in not only Adnans case but many others cases. Not to mention Bmore police were UNDER INVESTIGATION BY THE FBI. And don't forget one of the detectives in Adnans case was so un-credible he was not called to the stand. It's sad people can't look past Adnan or people like Freddie Gray just to name a few, and look at the police departments involved in their cases. All police aren't bad, but they aren't all good either.","Serial is a great podcast and Sara did a great job investigating and retracing steps. For those of you who think this podcast is one sided and or makes the police sound like a gang you’re ignorant. Theres way too much in not only Adnans case but many others cases. Not to mention Bmore police were UNDER INVESTIGATION BY THE FBI. And don’t forget one of the detectives in Adnans case was so un-credible he was not called to the stand. It’s sad people can’t look past Adnan or people like Freddie Gray just to name a few, and look at the police departments involved in their cases. All police aren’t bad, but they aren’t all good either."
1254,htriggc,20190309T140956,3,Too Biased,I enjoy the reporting but the radical liberal bias and perceived racial undertones that the reporter constantly presents make it tough to listen to. Bummer because this has the potential to be great if the reporter was a bit more objective versus having a very direct agenda.,I enjoy the reporting but the radical liberal bias and perceived racial undertones that the reporter constantly presents make it tough to listen to. Bummer because this has the potential to be great if the reporter was a bit more objective versus having a very direct agenda.
1257,Won't post,20190306T012603,4,Interesting!,"Sad that this young man has sat in prison for half of his young life, because police work is about gut instead of evidence and investigation. The story teller seemed to want him to be guilty, even though the evidence showed otherwise. I hate that they didn't continue to follow this story, it is much more interesting and shows the flaws of the ""justice"" system in our country. They ran off to do season 2 it was not interesting to me. Feel bad that he was a pow for 5 years, consequences for poor choices. His story didn't need to be told. Her compassion and understanding for his was amazing compared to how she believed a 17 year old honor student was a murderer. I wonder how much race played apart in her handling of the 2 men? Season 3 is offensive only listened to 2 episodes it was disgraceful and disgustingly racist. And no change in that system is coming to that courthouse.","Sad that this young man has sat in prison for half of his young life, because police work is about gut instead of evidence and investigation. The story teller seemed to want him to be guilty, even though the evidence showed otherwise. I hate that they didn't continue to follow this story, it is much more interesting and shows the flaws of the ""justice"" system in our country. 
They ran off to do season 2 it was not interesting to me. Feel bad that he was a pow for 5 years, consequences for poor choices. His story didn't need to be told. Her compassion and understanding for his was amazing compared to how she believed a 17 year old honor student was a murderer. I wonder how much race played apart in her handling of the 2 men??? Season 3 is offensive only listened to 2 episodes it was disgraceful and disgustingly racist. And no change in that system is coming to that courthouse."
1309,Dogmentin,20190207T025707,4,Season 3 Lost My Attention,"Season 1 was obviously phenomenal. Season 2 lived up to the high expectations, even if not quite as engrossing. Season 3 has such an important message and I'm so glad it's being talked about, but it kind of feels out of character and I'm not sure this podcast was the best platform for a discussion on structural racism, especially since it deviates so wildly from the storytelling narrative we expected from the first two seasons. Why not just start a new podcast and leave Serial as a serial?","Season 1 was obviously phenomenal. Season 2 lived up to the high expectations, even if not quite as engrossing. Season 3 has such an important message and I’m so glad it’s being talked about, but it kind of feels out of character and I’m not sure this podcast was the best platform for a discussion on structural racism, especially since it deviates so wildly from the storytelling narrative we expected from the first two seasons. Why not just start a new podcast and leave Serial as a serial?"
1322,Felix Snow,20190130T174725,1,Very Left-Leaning Angle,"While I like the first season, the third season reveals a very anti-police, anti-white slant that I find offputting. I know police officers in Cleveland and they say that they are sick of all the black crime and if they do anything forceful to detain a black criminal, they are under intense scrutiny. The commentator practically laughs at police who say they aren't going to change anything about the way they handle crime. She thinks the way they handle black suspects is racist - when it is not. I know cops handle criminals the same - whether black or white. If anything, they are more lenient on black criminals because of the intense media bias they face all the time. So I strongly dislike the third season. Again, it's become mainstream - so controlled by a leftist agenda - which is wrong.","While I like the first season, the third season reveals a very anti-police, anti-white slant that I find offputting. I know police officers in Cleveland and they say that they are sick of all the black crime and if they do anything forceful to detain a black criminal, they are under intense scrutiny. The commentator practically laughs at police who say they aren't going to change anything about the way they handle crime. She thinks the way they handle black suspects is racist - when it is not. I know cops handle criminals the same - whether black or white. If anything, they are more lenient on black criminals because of the intense media bias they face all the time. So I strongly dislike the third season. Again, it's become mainstream - so controlled by a leftist agenda - which is wrong."
1340,Shanynic,20190115T150853,4,Review From A Clevelander,"I love this podcast, but as a Clevelander, I'm torn between being super annoyed at your portrayal of Cleveland and being horrified that this is going on in my hometown. I'm a white woman from the west side. I've never seen these injustices. But it has definitely opened up conversations at home about racism.","I love this podcast, but as a Clevelander, I’m torn between being super annoyed at your portrayal of Cleveland and being horrified that this is going on in my hometown. I’m a white woman from the west side. I’ve never seen these injustices. But it has definitely opened up conversations at home about racism."
1344,TheCatnipTimes,20190116T150223,1,"Perfectly Illustrates What'S Broken In ""Journalism""","First, the production quality gets 5 stars. But Sarah, in her quest to find wrongs in the justice system (and there are) determines everyone in the justice system is racist all criminals are innocent victims of said system. Of course there are injustices - and that's terrible. But as Sarah is talking about racism, she doesn't hesitate in putting down ""the Jews,"" ""the Italians,"" and ""the Irish."" Really? Newsflash it's wrong to stereotype anyone. But in Sarah's view, it's okay to stereotype Jews, Irish and Italian ""white guys?"" Disappointing. And also not interesting. It's just another so-called reporter/journalist trying to be the news instead of reporting it.","First, the production quality gets 5 stars. But Sarah, in her quest to find wrongs in the justice system (and there are) determines everyone in the justice system is racist all criminals are innocent victims of said system. Of course there are injustices - and that’s terrible.  
But as Sarah is talking about racism, she doesn’t hesitate in putting down “the Jews,” “the Italians,” and “the Irish.” Really? Newsflash it’s wrong to stereotype anyone. But in Sarah’s view, it’s okay to stereotype Jews, Irish and Italian “white guys?” Disappointing. And also not interesting. It’s just another so-called reporter/journalist trying to be the news instead of reporting it."
1358,dance.morgan.dance,20190109T235157,1,Presumptuous And Biased,Season 3 is trash. What the judges and accused say is construed in whichever way Serial would like it to look for that specific case. This season is full of racial rhetoric with little to nothing that backs up these claims. I feel sorry for the people who were recorded for this piece. Their words are taken way out of context. Don't waste your time,Season 3 is trash. What the judges and accused say is construed in whichever way Serial would like it to look for that specific case. This season is full of racial rhetoric with little to nothing that backs up these claims. I feel sorry for the people who were recorded for this piece. Their words are taken way out of context. Don’t waste your time
1514,210 Rob,20181117T181540,3,Choosing Sides,"Listening to Season 3, I enjoy and appreciate Sarah and Emmanuel's line of questioning and investigative research however often it sounds like they are siding with the defendant. I'll allow that the defendant is often simultaneously a victim of vengeful, racist, immoral police officers and overzealous judges and prosecutors, but at the end of the day, these defendants/victims are criminals at their core and require at least rehabilitation and retribution at worst. As Sarah herself has asked, do they have a choice? Unequivocally, yes. Whether it's not walking around with a blunt or walking away from a bad situation, they always have a choice. I hope as I continue to follow this season that Sarah and the rest of the Serial team dig into the criminals a little more skeptically. I also hope we refocus on the courthouse and less on these particular cases which are interesting but not deeply intriguing or demonstrative.","Listening to Season 3, I enjoy and appreciate Sarah and Emmanuel’s line of questioning and investigative research however often it sounds like they are siding with the defendant.  I’ll allow that the defendant is often simultaneously a victim of vengeful, racist, immoral police officers and overzealous judges and prosecutors, but at the end of the day, these defendants/victims are criminals at their core and require at least rehabilitation and retribution at worst. As Sarah herself has asked, do they have a choice? Unequivocally, yes.  Whether it’s not walking around with a blunt or walking away from a bad situation, they always have a choice.  

I hope as I continue to follow this season that Sarah and the rest of the Serial team dig into the criminals a little more skeptically.  I also hope we refocus on the courthouse and less on these particular cases which are interesting but not deeply intriguing or demonstrative."
1519,gracie in seattle,20181116T231143,5,Sarah And Team Serial Kill It Again!,"Season 1 = amazing. Season 2 = not interesting to me. Season 3 = insighful, thoughtful, and scary in equal measures. Love Sarah's final summary (indictment) of the justice system in Cleveland...and beyond! In an early episode, Sarah says we'll explain later why her assistant reporter was born in Ohio but has an English accent. I was curious. If she got back to that in a later episode, I missed it... Looking forward to Season 4!","Season 1 = amazing. Season 2 = not interesting to me. Season 3 = insighful, thoughtful, and scary in equal measures. Love Sarah's final summary (indictment) of the justice system in Cleveland...and beyond! In an early episode, Sarah says we'll explain later why her assistant reporter was born in Ohio but has an English accent. I was curious. If she got back to that in a later episode, I missed it... Looking forward to Season 4!"
1527,Toasternuggest,20181116T164858,3,Season 3 Was A Let Down,"I loved season 1, and mostly liked season 2 (though it wasn't as interesting but was still worth listening to), but season 3—I just couldn't get excited about. I'm interested in law school, so hearing the perspective of the attorneys and what their daily work was like was great to hear for me personally, but the obvious bias in this season started to become obnoxious after a couple of episodes in. As someone with a criminal justice background, I absolutely agree that the system has flaws, that the justice system sentences minorities on a harsher scale across the country than whites, and that lengthy sentences do not deter crime. There is plenty of research to support this, but this season does little to actually support that with these stories. I feel like the constant argument is that the criminals interviewed for these stories, who are committing crimes over and over again (by their own choice most of the time), are somehow not to blame for their actions. Police brutality is certainly real and it happens, and I think in some of these reports it really happened and should've been punished, but I feel this season just painted everyone who works in the justice system, especially in Ohio, as racist and as if they have zero good intentions. It felt like an hour long blame game session, without any type of suggestion for how they would recommend fixing these issues. I'm generally left leaning in politics, but I just couldn't get over how wide a brush Serial used to paint everyone in a negative light except the habitual offenders. Oh and she absolutely lost me over the sentencing of the guy who shot the baby. I absolutely agree with that prosecutor. The season was okay. But it was that—just okay.","I loved season 1, and mostly liked season 2 (though it wasn’t as interesting but was still worth listening to), but season 3—I just couldn’t get excited about. I’m interested in law school, so hearing the perspective of the attorneys and what their daily work was like was great to hear for me personally, but the obvious bias in this season started to become obnoxious after a couple of episodes in. As someone with a criminal justice background, I absolutely agree that the system has flaws, that the justice system sentences minorities on a harsher scale across the country than whites, and that lengthy sentences do not deter crime. There is plenty of research to support this, but this season does little to actually support that with these stories. I feel like the constant argument is that the criminals interviewed for these stories, who are committing crimes over and over again (by their own choice most of the time), are somehow not to blame for their actions. Police brutality is certainly real and it happens, and I think in some of these reports it really happened and should’ve been punished, but I feel this season just painted everyone who works in the justice system, especially in Ohio, as racist and as if they have zero good intentions. It felt like an hour long blame game session, without any type of suggestion for how they would recommend fixing these issues. I’m generally left leaning in politics, but I just couldn’t get over how wide a brush Serial used to paint everyone in a negative light except the habitual offenders. Oh and she absolutely lost me over the sentencing of the guy who shot the baby. I absolutely agree with that prosecutor. 

The season was okay. But it was that—just okay."
1551,postcastjunkie72,20181115T134325,5,Required Listening,"I am obsessed with Season 3. Look, Season 1 was engrossing and turned a lot of people on to podcasts. Season 2, imo, was a misstep—I didn't finish it. But Season 3 should be required listening for all Americans. People have been waking up to a lot of things about racism and the injustices of the so-called criminal justice system. But Serial Season 3, by focusing on a group of individual stories within a specific system, really shows how deeply deeply corrupt and dysfunctional things are. Please listen.","I am obsessed with Season 3. Look, Season 1 was engrossing and turned a lot of people on to podcasts. Season 2, imo, was a misstep—I didn’t finish it. But Season 3 should be required listening for all Americans. People have been waking up to a lot of things about racism and the injustices of the so-called criminal justice system. But Serial Season 3, by focusing on a group of individual stories within a specific system, really shows how deeply deeply corrupt and dysfunctional things are. Please listen."
1578,bluebutterfly24,20181109T235137,1,Horrible And Racist,They should be ashamed of themselves. Listen to this if you believe in white supremacy and are racist. It's repulsive and disgusting how they coddle white supremacists and demonize people of color. Disgusting.,They should be ashamed of themselves. Listen to this if you believe in white supremacy and are racist. It’s repulsive and disgusting how they coddle white supremacists and demonize people of color. Disgusting.
1589,mliiccaah,20181108T055653,5,Loyal Listener And This Season Is My Fave So Far,"I loved Serial from the get-go. I thought the inconclusive ending of season 1 was done right and that the team stayed fair and honest by not passing their own verdict. But, as much as I loved that first season, I'm loving this one so much more. It speaks to the times when we know everything is socially fraught but there seems to be a taboo to raise the racial and gender issues behind them. Sarah's voice and narration are perfect for keeping a listener curious and engaged so much so that even the minutiae of the American legal system doesn't bore.","I loved Serial from the get-go. I thought the inconclusive ending of season 1 was done right and that the team stayed fair and honest by not passing their own verdict.

But, as much as I loved that first season, I’m loving this one so much more. It speaks to the times when we know everything is socially fraught but there seems to be a taboo to raise the racial and gender issues behind them. Sarah’s voice and narration are perfect for keeping a listener curious and engaged so much so that even the minutiae of the American legal system doesn’t bore."
1598,Obannion76,20181107T063446,3,The Soft Bigotry Of Low Expectations,"I just listened to S3 E2 and talk about the soft bigotry of low expectations! People who have shoplifted, robbed, stolen cars, even killed, failed to give up cocaine (not opioids, cocaine) while on probation, and otherwise risked abandonment of their children via getting hauled off to jail for these behaviors. But it is they, says Koenig, who are the victims — victims of lectures and slang and tough love by ""Irish judges"" who deign to hold them accountable for their actions and refuse to transfer them to the ""warm,"" hugging, Montessori judge over in ""Recovery Court."" Koenig is a natural investigator, has a fine eye for narrative, and is clearly a gifted storyteller. I enjoy the series. But portraying these folks as the victims of the judges who hold them accountable for the crimes they've chosen to commit (and the destruction they've chosen to invite to their families and children and, by extension, society at large) IS racism of the most menacing sort — I'm sorry, it just is. This episode is framed by the bigoted lense through which liberals like Koenig endeavor to project virtue (commonly referred to as ""the soft bigotry of low expectations"").","I just listened to S3 E2 and talk about the soft bigotry of low expectations!  People who have shoplifted, robbed, stolen cars, even killed, failed to give up cocaine (not opioids, cocaine) while on probation, and otherwise risked abandonment of their children via getting hauled off to jail for these behaviors.  But it is they, says Koenig, who are the victims — victims of lectures and slang and tough love by “Irish judges” who deign to hold them accountable for their actions and refuse to transfer them to the “warm,” hugging, Montessori judge over in “Recovery Court.”

Koenig is a natural investigator, has a fine eye for narrative, and is clearly a gifted storyteller.  I enjoy the series.  But portraying these folks as the victims of the judges who hold them accountable for the crimes they’ve chosen to commit (and the destruction they’ve chosen to invite to their families and children and, by extension, society at large) IS racism of the most menacing sort — I’m sorry, it just is.  This episode is framed by the bigoted lense through which liberals like Koenig endeavor to project virtue (commonly referred to as “the soft bigotry of low expectations”)."
1599,s.l.h 12345,20181106T230034,1,Racist,Season one was amazing! This season seems to be about racism.... so is everything else these days so It's boring.,Season one was amazing! This season seems to be about racism.... so is everything else these days so It’s boring.
1607,MEKmommy,20181103T050534,1,Season 3 Is Downright Racist,I'm shocked at her tone in this. Just gross.,I’m shocked at her tone in this. Just gross.
