index,user,timestamp,rating,title,review,review_raw
437,Lisasueann,20210124T045946,1,Racism Goes Both Ways,Season one? Excellent. 2 and 3? Don't waste your time. Season 4? Completely biased and racist. This is one of the worst podcasts (trying so hard to implement white guilt) that I've ever heard. I have no white guilt nor should I. You should be ashamed.,Season one? Excellent. 2 & 3? Don’t waste your time. Season 4? Completely biased and racist. This is one of the worst podcasts (trying so hard to implement white guilt) that I’ve ever heard. I have no white guilt nor should I. You should be ashamed.
441,mmmsophisticatedmama,20210106T001643,1,Quit After Season 1,"Binge season one with a big ole spoon. Take or leave seasons 2 and 3 due to the ""meh"" nature of the stories. Season 4? I won't even listen to racist drivel.",Binge season one with a big ole spoon. Take or leave seasons 2 and 3 due to the “meh” nature of the stories. Season 4? I won’t even listen to racist drivel.
446,Laurikeet,20210101T162837,5,Incisive And Excellent,"I know this school, and she got it right. Every episode covered a different topic, one more fascinating than the next. If you are a liberal white parent who espouses belief in integration and lives in a diverse neighborhood, yet chooses not to send your children to the school on the corner (without even looking at it), you might feel accused of racism. You might be asked to look at yourselves, at your subversion of the school choice movement, at your reasons for choosing the many private schools that opened after your city tried to integrate, aiming directly at your demographic by curating the exact number of students of color with which your child will be surrounded. It might be hard. When you hear the children, parents, and educators whom you worked so hard and payed so much to ensure that your child would never meet, you might think, ""Why, these children are smart, these parents are like me, these teachers know so much about subject matter and pedagogy! Why did I so prioritize avoiding this good experience for my child?"" It may be hard. But it ends with real thinking and points to ways forward. It is honest, fascinating, powerful, and utterly listenable. Finish all episodes.","I know this school, and she got it right. Every episode covered a different topic, one more fascinating than the next. If you are a liberal white parent who espouses belief in integration and lives in a diverse neighborhood, yet chooses not to send your children to the school on the corner (without even looking at it), you might feel accused of racism. You might be asked to look at yourselves, at your subversion of the school choice movement, at your reasons for choosing the many private schools that opened after your city tried to integrate, aiming directly at your demographic by curating the exact number of students of color with which your child will be surrounded. It might be hard. When you hear the children, parents, and educators whom you worked so hard and payed so much to ensure that your child would never meet, you might think, “Why, these children are smart, these parents are like me, these teachers know so much about subject matter and pedagogy! Why did I so prioritize avoiding this good experience for my child?” It may be hard. But it ends with real thinking and points to ways forward. It is honest, fascinating, powerful, and utterly listenable. Finish all episodes."
448,Warlord565956,20210101T185429,1,Crap,This is anti racist woke crap. America does not agree with this.,This is anti racist woke crap. America does not agree with this.
451,Korotai-chan,20201218T100109,5,In Depth Journalism And The Haters,"I was first introduced to Serial shortly after season one aired by a college professor that had turned listening to the podcast (and analyzing it) into an assignment. And I've gotta say, ever since then, the in depth journalism and adept way the story is narrated and structured has always grabbed my attention. I can say all of the seasons are definitely binge worthy. And a note about everyone giving a one star review for this podcast just over the 5 episodes of ""Nice White Parents"", it's most likely that they fulfill that classification and instead of listening and trying to view the world from a different perspective, they'd rather continue to ignore the fact that there is inherent racism in almost every single aspect of U.S. society. Blissful ignorance. Bottom line is, please listen. Educate. And above all else, keep in mind that your perspective on the world isn't the only one, and it's always worth understanding someone else, because that's how we grow.","I was first introduced to Serial shortly after season one aired by a college professor that had turned listening to the podcast (and analyzing it) into an assignment. And I’ve gotta say, ever since then, the in depth journalism and adept way the story is narrated and structured has always grabbed my attention. I can say all of the seasons are definitely binge worthy. 

And a note about everyone giving a one star review for this podcast just over the 5 episodes of “Nice White Parents”, it’s most likely that they fulfill that classification and instead of listening and trying to view the world from a different perspective, they’d rather continue to ignore the fact that there is inherent racism in almost every single aspect of U.S. society. Blissful ignorance. 

Bottom line is, please listen. Educate. And above all else, keep in mind that your perspective on the world isn’t the only one, and it’s always worth understanding someone else, because that’s how we grow."
458,963369,20201215T182028,1,Racists Hiding As Journalists,"The first season started off very interesting. Good attempts at being in depth with facts, but author just uses the facts that support her narrative and dismisses any facts that do not support her thesis of the justice system is wrong. Second season, again, is a interesting and entertaining premise, but the bashing of the justice system is broken and racist keeps getting in the way. Third season doesn't even try to hide the pure abhorrence of white people. A continuation of white people are evil and all other races are held back by no fault of their own. Not a real look at the issues. Just speaks of the facts that support the authors narrative.","The first season started off very interesting.  Good attempts at being in depth with facts, but author just uses the facts that support her narrative and dismisses any facts that do not support her thesis of the justice system is wrong.  Second season, again, is a interesting and entertaining premise, but the bashing of the justice system is broken and racist keeps getting in the way.  Third season doesn't even try to hide the pure abhorrence of white people.  A continuation of white people are evil and all other races are held back by no fault of their own.  Not a real look at the issues.  Just  speaks of the facts that support the authors narrative."
461,teddy66,20201215T041303,1,Typical,"As a liberal, it's exhausting to listen to these bigoted woke leftists reduce immensely complicated issues into simplistic (and racist) solutions. Avoid if your IQ is three digits.","As a liberal, it’s exhausting to listen to these bigoted woke leftists reduce immensely complicated issues into simplistic (and racist) solutions.  Avoid if your IQ is three digits."
468,hispanicwoman,20201205T232358,1,Pushing Anti-Racism,"I loved the first two seasons of serial but pushing the whole ""everyone is racist"" and ""white people are the problem"" is dangerous and disingenuous. Don't recommend.",I loved the first two seasons of serial but pushing the whole “everyone is racist” and “white people are the problem” is dangerous and disingenuous. Don’t recommend.
479,Josh whoa,20201114T041726,1,A Turn For The Worse,"I absolutely loved the first three seasons of this show, however with season four you've lost a listener forever. They're seriously making the case that the problem with inadequate education in certain areas is the fault of and I quote ""white parents"". They went full ""woke"" with this one guys. They live in an echo chamber where racism is the causation behind every issue in America.","I absolutely loved the first three seasons of this show, however with season four you’ve lost a listener forever. They’re seriously making the case that the problem with inadequate education in certain areas is the fault of and I quote “white parents”. They went full “woke” with this one guys. They live in an echo chamber where racism is the causation behind every issue in America."
490,All the g00d nicknames taken,20201029T151451,3,Nice White Parents Review,"Pros: The style of discussion is engaging and it is well researched. Tracing the history of one school district certainly allows one to see trends in behavior over time. This is a great in-depth examination. As someone who lives in a more rural area, learning about a city school system is fascinating since it is so different than how schools in my area are organized. Cons: Too often, the author tries to over-generalize, arguing that the problems of the NYC school system are problems everywhere with little proof. However, sometimes she does state the NYC is unique in being the most segregated school system in America (Ep 5), therefore occasionally demonstrating that some of these problems are unique to this type of school system. She leaves some threads unexplored; why is there a correlation between liberalism and segregation in schools? She mentions this, but only in passing. Like all podcasts, this one is biased towards the author's beliefs (everything is fault of nice white parents), but it does give a great window into the elite liberal view of public schools. Overall: The podcast was good for what it is - an examination of problems in one school system. It's overall applicability to the nation as a whole is limited, despite the author's best attempts to make it so. Fascinating entertainment, and worth discussing, but not profound - unless you're someone who is shocked that wealthy, liberal parents might try to stack the deck in favor of themselves.","Pros: The style of discussion is engaging and it is well researched. Tracing the history of one school district certainly allows one to see trends in behavior over time. This is a great in-depth examination. As someone who lives in a more rural area, learning about a city school system is fascinating since it is so different than how schools in my area are organized.

Cons: Too often, the author tries to over-generalize, arguing that the problems of the NYC school system are problems everywhere with little proof. However, sometimes she does state the NYC is unique in being the most segregated school system in America (Ep 5), therefore occasionally demonstrating that some of these problems are unique to this type of school system. She leaves some threads unexplored; why is there a correlation between liberalism and segregation in schools? She mentions this, but only in passing. Like all podcasts, this one is biased towards the author’s beliefs (everything is fault of nice white parents), but it does give a great window into the elite liberal view of public schools. 

Overall: The podcast was good for what it is - an examination of problems in one school system. It’s overall applicability to the nation as a whole is limited, despite the author’s best attempts to make it so. Fascinating entertainment, and worth discussing, but not profound - unless you’re someone who is shocked that wealthy, liberal parents might try to stack the deck in favor of themselves."
500,fiddler571,20201013T215353,4,Very Informative,"So I really love these podcasts. I always learn so much and it is very evident that a lot of thought and effort goes into them. I think though, that as an educated yet poor white male, I have a different takeaway from this research that makes me resent it in some ways. What I noticed is that there are different cultures that all have different beliefs for what was important, but I believe that many of the issues raised here were due to financial inequalities and not racial biases. Nobody in power listens to poor people because it seems as if they don't have power to give. That goes for all of us poor white families who live in these same neighborhoods that you talk about here. When a thousand rich families move to an area it sways everyone's access that isn't because of color but because of money. Am I wrong for seeing this in my own circumstances and relating it to this podcast?","So I really love these podcasts. I always learn so much and it is very evident that a lot of thought and effort goes into them. I think though, that as an educated yet poor white male, I have a different takeaway from this research that makes me resent it in some ways. What I noticed is that there are different cultures that all have different beliefs for what was important, but I believe that many of the issues raised here were due to financial inequalities and not racial biases. Nobody in power listens to poor people because it seems as if they don’t have power to give. That goes for all of us poor white families who live in these same neighborhoods that you talk about here. When a thousand rich families move to an area it sways everyone’s access that isn’t because of color but because of money. Am I wrong for seeing this in my own circumstances and relating it to this podcast?"
513,ECFS1234,20201007T212024,1,Same Voice Same Problem,"Literally every time I listen to a podcast made by serial about race and justice - it's a nightmare. Being a journalist does not erase your bias- identifying your race at the beginning does not make your voice objective, and it's the same thing every time. Innocent white lady who's just trying to understand what's going on; forcing POC to nicely explain racism 101. The condescension in her voice when she's referring to the equity team that came to the school to talk about the work of identifying implicit bias, is disgusting. Addressing racism IS work. Equity IS work. You need to understand how YOU benefit from the system to tell the story properly. Just because you know you're white doesn't mean you understand race and racism in the United States. PLEASE HIRE OTHER PEOPLE TO TELL THESE STORIES or EDUCATE YOURSELF ABOUT RACE. PERIOD.","Literally every time I listen to a podcast made by serial about race and justice - it’s a nightmare. 

Being a journalist does not erase your bias- identifying your race at the beginning does not make your voice objective, and it’s the same thing every time. Innocent white lady who’s just trying to understand what’s going on; forcing POC to nicely explain racism 101. 

The condescension in her voice when she’s referring to the equity team that came to the school to talk about the work of identifying implicit bias, is disgusting. Addressing racism IS work. Equity IS work. You need to understand how YOU benefit from the system to tell the story properly. Just because you know you’re white doesn’t mean you understand race and racism in the United States. 

PLEASE HIRE OTHER PEOPLE TO TELL THESE STORIES or EDUCATE YOURSELF ABOUT RACE. PERIOD."
514,Missphil,20201007T185442,5,Really Enjoyable,"I loved listening to Nice White parents.. very informative for me as a white mom of biracial preschoolers. The point is that we must come together for the greater good of all children, not just of our own.","I loved listening to Nice White parents.. very informative for me as a white mom of biracial preschoolers. The point is that we must come together for the greater good of all children, not just of our own."
520,JulliG,20200928T003119,5,Seasons 1-3 Were Great,"I really love Sarah Koenig and the first several seasons. It was a bad choice to add the Nice White Parents podcast to the lineup. I found the information to be interesting but I didn't find it to be fairly assessed. For example, it seems to demonize the parents who wrote in support of integration but didn't send their kids to that school. There was no justification of the school not opening for 5 years after the letters were written or that these parents all seemed to be interested in giving their child the best education available while wanting to support integration. The last episode also talked a great deal about how nothing changes unless white parents raise the issue. While that may be true it may also be said that nothing changes unless the majority of people are concerned. As a white person I have no problem with bringing to light the dramatic injustices that have happened as a result of racial inequality. I just don't think this story was told fairly or without bias as I have come to expect from Serial. Still giving 5 stars though because the actual podcast is excellent and I support the risk that was taken to promote this series here.","I really love Sarah Koenig & the first several seasons. It was a bad choice to add the Nice White Parents podcast to the lineup. I found the information to be interesting but I didn’t find it to be fairly assessed. For example, it seems to demonize the parents who wrote in support of integration but didn’t send their kids to that school. There was no justification of the school not opening for 5 years after the letters were written or that these parents all seemed to be interested in giving their child the best education available while wanting to support integration. The last episode also talked a great deal about how nothing changes unless white parents raise the issue. While that may be true it may also be said that nothing changes unless the majority of people are concerned. As a white person I have no problem with bringing to light the dramatic injustices that have happened as a result of racial inequality. I just don’t think this story was told fairly or without bias as I have come to expect from Serial. Still giving 5 stars though because the actual podcast is excellent & I support the risk that was taken to promote this series here."
522,Shqipetare21,20200923T111909,5,The 1-Stars Are The Problem,"The fragile ppl (white ppl) giving 1 stars are the ones who don't want to take responsibility for their privilege and actually eliminate racism. They profit from it so they have no interest in change. Great 3rd season with lessons taught. But, as you can see from some of their names, some ppl are a lost cause.","The fragile ppl (white ppl) giving 1 stars are the ones who don’t want to take responsibility for their privilege and actually eliminate racism. They profit from it so they have no interest in change. 

Great 3rd season with lessons taught. But, as you can see from some of their names, some ppl are a lost cause."
529,JudeandJess,20200915T150335,5,Uncomfortable,"This subject makes a lot of people uncomfortable, including myself. The comments show people will run back to the same arguments over and over again, which is why this country is still where it is. The podcast is older so the term systemic racism isn't as popular yet. The message is clear. Children do not have equal opportunity. Parents that have time to petition or have their staff petition for their children, are not the norm. Children that misbehave one year should not suffer for the rest of their school career. The author is right, you can't measure nice! And you can't punish kids because both parents have to work or they can't afford a French tutor and so on. I would listen, with an open mind. Is it going to attack you personally? Yes. You'll be ok though. This author isn't solving anything but telling a story and an outcome, which we all can take lessons from. So get over yourself and grow.","This subject makes a lot of people uncomfortable, including myself. The comments show people will run back to the same arguments over and over again, which is why this country is still where it is. The podcast is older so the term systemic racism isn’t as popular yet. The message is clear. Children do not have equal opportunity. Parents that have time to petition or have their staff petition for their children, are not the norm. Children that misbehave one year should not suffer for the rest of their school career. The author is right, you can’t measure nice! And you can’t punish kids because both parents have to work or they can’t afford a French tutor and so on. 

I would listen, with an open mind. Is it going to attack you personally? Yes. You’ll be ok though. This author isn’t solving anything but telling a story and an outcome, which we all can take lessons from. So get over yourself and grow."
531,frissjan,20200918T025244,3,Loved This Podcast Until This Season,"LOVED this podcast until ""Nice White Parents."" What a dreary deamonization of hard-working, well-meaning parents who are white. Such an incredibly obvious slant from the very first episode of the season. It's true that Racism is real in our country. It needs to end, but trashing white people and mocking ""Karens"" is an ineffective approach that only furthers the divide.","LOVED this podcast until “Nice White Parents.” What a dreary deamonization of hard-working,  well-meaning parents who are white. Such an incredibly obvious slant from the very first episode of the season. It’s true that Racism is real in our country. It needs to end, but trashing white people and mocking “Karens” is an ineffective approach that only furthers the divide."
533,SierraJoyH,20200916T041810,2,Disappointed,"I've enjoyed all the seasons thus far and learned from it but this new season is entirely race focused for no good reason. They focus of the season is to ""expose"" or more like put down members of one race. If that isn't racist, then nothing is. The problems you may be seeing don't need to be framed as a race issue. There's a lot of other factors in human behavior so looking at everything through such a narrow, race-colored lens is ridiculous and distorted. Thanks, but no thanks this season.","I’ve enjoyed all the seasons thus far and learned from it but this new season is entirely race focused for no good reason. They focus of the season is to “expose” or more like put down members of one race. If that isn’t racist, then nothing is. The problems you may be seeing don’t need to be framed as a race issue. There’s a lot of other factors in human behavior so looking at everything through such a narrow, race-colored lens is ridiculous and distorted. Thanks, but no thanks this season."
535,JackieSola,20200914T030406,5,Best Season Yet!,"I absolutely loved this season on Nice White Parents. To the white people out there who think calling out white privilege, structural racism and inequity is divisive, you are part of the problem. How convenient of you to ignore and fail to see issues that doesn't affect you. The fact that you don't see a problem doesn't mean it doesn't exist.","I absolutely loved this season on Nice White Parents. To the white people out there who think calling out white privilege, structural racism and inequity is divisive, you are part of the problem. How convenient of you to ignore and fail to see issues that doesn’t affect you. The fact that you don’t see a problem doesn’t mean it doesn’t exist."
536,sleeping jake,20200912T044235,5,The Reviews Are As Interesting As The Show,"The comments to this podcast just demonstrate how incredibly sad our country is and how much suffering people must continue to endure for a conscious unwillingness to reconcile, repudiate, and repair our ancestors racist and oppressive past. The shrill and negative comments just show the fear we white people have of admitting our own privilege and that someday they could lose it. Anger as demonstrated in these reviews, is simply fear turned inside out. Thank you for bringing this subject to light and giving us parents more to process and a chance to keep working on exerting our privilege less and listening more.","The comments to this podcast just demonstrate how incredibly sad our country is and how much suffering people must continue to endure for a conscious unwillingness to reconcile, repudiate, and repair our ancestors racist and oppressive past.  The shrill and negative comments just show the fear we white people have of admitting our own privilege and that someday they could lose it. Anger as demonstrated in these reviews, is simply fear turned inside out. Thank you for bringing this  subject to light and giving us parents more to process and a chance to keep working on exerting our privilege less and listening more."
538,3rd,20200911T223646,5,White Male Here Who Enjoyed The Podcast,"What out for all the reviews from white folks who are triggered by being challenged. It's difficult to accept that when some white folks think we're helping, we're actually not. And sometimes....wait for it...white people are actually wrong. I'm a white male so I'm speaking to myself as much as I'm speaking to all the people who gave this a 1-star because ""there's just no pleasing anyone,"" or because ""white people experience racism too."" Haha","What out for all the reviews from white folks who are triggered by being challenged. It’s difficult to accept that when some white folks think we’re helping, we’re actually not. And sometimes....wait for it...white people are actually wrong. I’m a white male so I’m speaking to myself as much as I’m speaking to all the people  who gave this a 1-star because “there’s just no pleasing anyone,” or because “white people experience racism too.” Haha"
